{
  "$schema": "../schemas/lesson.schema.json",
  "schemaVersion": "1.0.0",
  "id": "lesson-hsk1-09",
  "slug": "hsk1-bai-09-con-trai-anh-lam-viec-o-dau",
  "profile": "hsk-foundation",
  "status": "review",
  "metadata": {
    "courseId": "course-hsk-standard-1",
    "levelId": "hsk-1",
    "lessonNumber": 9,
    "titleVi": "Con trai anh làm việc ở đâu?",
    "titleZh": "你儿子在哪儿工作？",
    "heroHanzi": "你儿子在哪儿工作？",
    "summaryVi": "Dữ liệu bài 9 được chuyển đổi từ Giáo trình chuẩn HSK 1.",
    "estimatedMinutes": 29,
    "skills": [
      "listening",
      "speaking",
      "reading",
      "writing"
    ],
    "source": {
      "printedPages": [
        76,
        83
      ],
      "pdfPages": [
        74,
        81
      ],
      "missingPrintedPages": []
    }
  },
  "access": {
    "tier": "free",
    "previewSectionIds": []
  },
  "objectives": [
    {
      "id": "objective-hsk1-l09-dialogue",
      "skill": "speaking",
      "descriptionVi": "Thực hiện các mẫu hội thoại trọng tâm của Bài 9."
    },
    {
      "id": "objective-hsk1-l09-vocabulary",
      "skill": "reading",
      "descriptionVi": "Nhận biết 13 mục từ mới của bài."
    },
    {
      "id": "objective-hsk1-l09-writing",
      "skill": "writing",
      "descriptionVi": "Luyện viết 3 chữ Hán trọng tâm."
    }
  ],
  "prerequisites": [
    "lesson:lesson-hsk1-08"
  ],
  "sections": [
    {
      "id": "section-hsk1-l09-introduction",
      "type": "introduction",
      "titleVi": "Giới thiệu",
      "required": true,
      "estimatedMinutes": 1,
      "content": {
        "kickerVi": "Bài 9 · HSK 1",
        "heroHanzi": "你儿子在哪儿工作？",
        "summaryVi": "Con trai anh làm việc ở đâu?",
        "sourcePrintedPages": [
          76,
          83
        ],
        "sourcePdfPages": [
          74,
          81
        ]
      }
    },
    {
      "id": "section-hsk1-l09-dialogue",
      "type": "dialogue",
      "titleVi": "Bài học và hội thoại",
      "required": true,
      "estimatedMinutes": 5,
      "itemRefs": [
        "dialogue:dialogue-hsk1-l09-01",
        "dialogue:dialogue-hsk1-l09-02",
        "dialogue:dialogue-hsk1-l09-03"
      ],
      "presentation": {
        "showPinyinByDefault": true,
        "showTranslationByDefault": true,
        "allowPlayAll": false,
        "audioUnavailableReason": "missing-source-audio"
      }
    },
    {
      "id": "section-hsk1-l09-vocabulary",
      "type": "vocabulary",
      "titleVi": "Từ mới",
      "required": true,
      "estimatedMinutes": 5,
      "itemRefs": [
        "lexeme:lex-hsk1-l09-01",
        "lexeme:lex-hsk1-l09-02",
        "lexeme:lex-hsk1-l09-03",
        "lexeme:lex-hsk1-l09-04",
        "lexeme:lex-hsk1-l09-05",
        "lexeme:lex-hsk1-l09-06",
        "lexeme:lex-hsk1-l09-07",
        "lexeme:lex-hsk1-l09-08",
        "lexeme:lex-hsk1-l09-09",
        "lexeme:lex-hsk1-l09-10",
        "lexeme:lex-hsk1-l09-11",
        "lexeme:lex-hsk1-l09-12",
        "lexeme:lex-hsk1-l09-13"
      ]
    },
    {
      "id": "section-hsk1-l09-grammar",
      "type": "grammar",
      "titleVi": "Chú thích ngữ pháp",
      "required": true,
      "estimatedMinutes": 4,
      "itemRefs": [
        "grammar-point:grammar-hsk1-l09-01",
        "grammar-point:grammar-hsk1-l09-02",
        "grammar-point:grammar-hsk1-l09-03",
        "grammar-point:grammar-hsk1-l09-04"
      ],
      "sourceAvailability": "available"
    },
    {
      "id": "section-hsk1-l09-listening",
      "type": "listening",
      "titleVi": "Nghe theo track giáo trình",
      "required": false,
      "estimatedMinutes": 0,
      "itemRefs": [
        "media:media-hsk1-track-09-1",
        "media:media-hsk1-track-09-2",
        "media:media-hsk1-track-09-3"
      ],
      "availability": "blocked-missing-audio-files"
    },
    {
      "id": "section-hsk1-l09-pronunciation",
      "type": "pronunciation",
      "titleVi": "Phần ghép âm",
      "required": true,
      "estimatedMinutes": 3,
      "itemRefs": [
        "pronunciation-topic:pronunciation-hsk1-l09"
      ]
    },
    {
      "id": "section-hsk1-l09-writing",
      "type": "writing",
      "titleVi": "Chữ Hán",
      "required": true,
      "estimatedMinutes": 4,
      "itemRefs": [
        "character:char-hsk1-u5728",
        "character:char-hsk1-u5b50",
        "character:char-hsk1-u5de5"
      ],
      "strokeAssetStatus": "use-hanzi-writer-runtime-data"
    },
    {
      "id": "section-hsk1-l09-practice",
      "type": "practice",
      "titleVi": "Luyện tập và vận dụng",
      "required": true,
      "estimatedMinutes": 4,
      "itemRefs": [
        "assessment-item:assessment-hsk1-l09-meaning",
        "assessment-item:assessment-hsk1-l09-pinyin"
      ],
      "sourceActivityTypes": [
        "warm-up-image-match",
        "role-play-source-dialogues",
        "answer-situational-questions",
        "pair-or-group-application"
      ],
      "provenance": {
        "sourceActivities": "summarized-from-book",
        "assessmentItems": "derived-not-verbatim"
      }
    },
    {
      "id": "section-hsk1-l09-flashcard",
      "type": "flashcard",
      "titleVi": "Flashcard",
      "required": false,
      "estimatedMinutes": 3,
      "itemRefs": [
        "lexeme:lex-hsk1-l09-01",
        "lexeme:lex-hsk1-l09-02",
        "lexeme:lex-hsk1-l09-03",
        "lexeme:lex-hsk1-l09-04",
        "lexeme:lex-hsk1-l09-05",
        "lexeme:lex-hsk1-l09-06",
        "lexeme:lex-hsk1-l09-07",
        "lexeme:lex-hsk1-l09-08",
        "lexeme:lex-hsk1-l09-09",
        "lexeme:lex-hsk1-l09-10",
        "lexeme:lex-hsk1-l09-11",
        "lexeme:lex-hsk1-l09-12",
        "lexeme:lex-hsk1-l09-13"
      ],
      "generatedFromSectionId": "section-hsk1-l09-vocabulary"
    },
    {
      "id": "section-hsk1-l09-completion",
      "type": "completion",
      "titleVi": "Hoàn thành",
      "required": true,
      "estimatedMinutes": 0,
      "summary": {
        "titleVi": "Hoàn thành Bài 9",
        "messageVi": "Bạn đã hoàn thành nội dung 你儿子在哪儿工作？"
      }
    }
  ],
  "completionRule": {
    "type": "combined",
    "requiredSectionIds": [
      "section-hsk1-l09-introduction",
      "section-hsk1-l09-dialogue",
      "section-hsk1-l09-vocabulary",
      "section-hsk1-l09-pronunciation",
      "section-hsk1-l09-writing",
      "section-hsk1-l09-practice",
      "section-hsk1-l09-grammar"
    ],
    "minimumPracticeScorePercent": 50,
    "allowManualCompletion": false
  },
  "editorial": {
    "contentVersion": 1,
    "languageReviewStatus": "pending",
    "audioReviewStatus": "blocked-missing-file",
    "reviewerIds": [],
    "sourceNotes": [
      "Dữ liệu được chuyển đổi từ bản PDF scan do người dùng cung cấp.",
      "Pinyin ở các câu hội thoại được tạo tự động và cần được biên tập ngôn ngữ kiểm tra trước khi xuất bản.",
      "Bài tập trắc nghiệm là dữ liệu suy diễn từ từ vựng nguồn, không phải bản chép nguyên văn bài tập trong sách."
    ],
    "updatedAt": "2026-08-30T00:00:00.000Z"
  }
}
